job_title,company,location,responsibilities,requirements,salary_from,salary_to,salary_currency,posted_date,url,category,skills,position,experience,education,salaryLead Infrastructure Engineer,Гарда Технологии,Нижний Новгород,"...заказчика или напрямую оказывают заказчику помощь по выявлению событий информационной безопасности, с помощью решений компании. Чем предстоит заниматься: Управление инфраструктурой...",Понимание процесса непрерывной интеграции CI\CD. Будет плюсом: Знание CI/CD. Понимание принципов работы систем информационной безопасности.,,,,2025-05-12,https://hh.ru/vacancy/120397168,"['security', 'devops']",['ci/cd'],['senior'],,,
"Инженер по автоматизации тестирования, Python, API, Ozon Bank",Ozon,Нижний Новгород,Вам предстоит: Участвовать в организации и улучшении процессов тестирования вместе с командой QA. Тестировать сервисы (в основном back-end).,Вы знаете и хорошо понимаете основные принципы тестирования и автоматизации. Обладаете опытом работы с автотестами в CI. Обладаете опытом тестирования...,,,,2025-05-06,https://hh.ru/vacancy/119213261,"['qa', 'backend']",['python'],,,,
Менеджер по проектным продажам,АйЭсТи,Нижний Новгород,"Продажи программного обеспечения, оборудования, услуг по информационной безопасности. Анализ технических требований, поиск оптимальных решений задач клиента совместно с технической службой.","Высшее образование, (предпочтительно техническое). Будет преимуществом опыт в области IT и/или информационной безопасности.",100000.0,,RUR,2025-05-05,https://hh.ru/vacancy/118065191,['security'],,,,Bachelor,100000.0
Специалист по ТЗИ,ФГУП НПП Гамма,Нижний Новгород,"Изучение законодательства РФ и требований регуляторов в области защиты информации. Внедрение средств защиты информации (установка, настройка, монтаж средств защиты информации).","Знание технического устройства ПК и серверов. Понимание принципов построения систем защиты информации. Заинтересованность в работе. Умение вести деловые переговоры, деловую...",70000.0,,RUR,2025-04-21,https://hh.ru/vacancy/119781196,,,,,,70000.0
Главный специалист по обеспечению информационной безопасности (Советский р-он),ТНС энерго Нижний Новгород,Нижний Новгород,"Проведение проверок соблюдения требований информационной безопасности. Знание принципов построения систем безопасности в рамках защиты персональных данных, защиты критической информационной инфраструктуры...","Высшее образование по направлению подготовки в области информационной безопасности и/или высшее образование с переподготовкой по направлению ""Информационная безопасность"".",85500.0,94400.0,RUR,2025-04-23,https://hh.ru/vacancy/118896026,['security'],,,,Bachelor,89950.0
Специалист по информационной безопасности,ГБУЗ НО Городская больница № 33,Нижний Новгород,"Администрирования антивирусной защиты, мониторинг состояния клиентов, удаление вирусов, тонкая настройка защиты. Поиск уязвимостей с помощью специализированного ПО и их устранение.","Опыт администрирования ОС Windows от 1-го года. Базовые знания ОС Linux от 1-го года, уверенная работа в командной...",,,,2025-04-22,https://hh.ru/vacancy/117818168,"['tools', 'security', 'backend']","['go', 'linux']",,,,
Ведущий программист,Приволжский филиал ФГБУ ЦЭПП МЧС России,Нижний Новгород,"Осуществление мероприятий в области информационной безопасности. Обеспечивать защиту информации при взаимодействии с внешними источниками, организациями. Осуществление сопровождения внедренных программ и...","...в области информационных технологий, опыт работы не менее 1 года в должности программиста или других должностях в области информационных технологий.",42000.0,44000.0,RUR,2025-04-17,https://hh.ru/vacancy/119635616,,,['senior'],1,,43000.0
Ведущий специалист-эксперт отдела организационно-технической и криптографической защиты информации,Отделение Фонда Пенсионного и Социального Страхования Российской Федерации по Нижегородской Области,Нижний Новгород,"Работа со средствами криптографической защиты информации (установка, настройка), работа с электронной подписью, работа техническими средствами защиты информации (антивирус, средства межсетевого...",Высшее или среднее профессиональное образование по направлению информационной безопасности или информационных технологий. Знание основ информационной безопасности (в т.ч.,30000.0,45000.0,RUR,2025-05-09,https://hh.ru/vacancy/119311980,['security'],,['senior'],,,37500.0
Site Reliability Engineer (SRE) / Software Engineer,Т-Банк,Нижний Новгород,"Участвовать в устранении сбоев и расследовании их причин. Повышать Observability приложений. Проектировать, внедрять и поддерживать метрики для мониторинга.","Разделяете принцип проактивности: лучше предотвратить сбой, чем потом его устранять. Понимаете принципы построения CI/CD-пайплайнов и IaC-подхода.",,,,2025-05-12,https://hh.ru/vacancy/120379011,['devops'],['ci/cd'],,,,
Специалист по сертификации,Гарда Технологии,Нижний Новгород,Анализ требований регуляторов ФСТЭК России/ФСБ России в области защиты информации. Взаимодействие со структурными подразделениями Компании в части процессов сертификационных...,"Знание нормативно-методических документов РФ в области защиты информации, в частности требований ФСТЭК России к различным СЗИ. Понимание требований и...",,,,2025-05-06,https://hh.ru/vacancy/120281709,,,,,,
Middle Fullstack Developer,Гарда Технологии,Нижний Новгород,Немного о проекте: Участие в разработке Frontend на JavaScript/TypeScript и React. Исследование и возможный багфикс проблем на стыке модулей.,Опыт создания Frontend-приложений с глубоким пониманием JS/TS. Знание языка программирования PHP. Опыт написания и отладки SQL (MariaDB/MySQL...,,,,2025-04-14,https://hh.ru/vacancy/119475281,"['web', 'data']","['sql', 'mysql', 'javascript']",['middle'],,,
Java разработчик(Platform V Works::TaskTracker),SberTech,Нижний Новгород,"Мы — команда Platform V Works, часть облачной цифровой платформы Сбера для разработки бизнес-приложений. Разрабатываем высокотехнологичные IT-продукты и обеспечиваем...","Опыт внедрения и работы с ML, поисковыми алгоритмами и NLP технологиями, инструментами синтаксического разбора (ANTLR). Опыт профилирования приложений - поиск утечек...",,,,2025-04-16,https://hh.ru/vacancy/119594197,"['ml', 'backend']",['java'],,,,
Аналитик качества данных,СБЕР,Нижний Новгород,"Ведение инцидент-менеджмента по вопросам качества данных. Применение в системе контроля новых методов, в том числе способов машинного обучения (ML).","Высшее образование. Владение языком программирования SQL не ниже среднего уровня. Навыки работы с базами данных (например, Greenplum, SQL Server).",,,,2025-04-14,https://hh.ru/vacancy/119475222,['data'],['sql'],,,Bachelor,
Программист-разработчик С++,Маркет Групп,Нижний Новгород,"Статический и динамический анализ ядра Linux и разрабатываемого компанией программного обеспечения. Поиск и исправление уязвимостей. Разработка, отладка и оптимизация кода.","Знание языка Си и ассемблера x86-64. Знание современных средств разработки, отладки и анализа кода (gitlab, gcc, svace, syzcaller...",220000.0,,RUR,2025-04-14,https://hh.ru/vacancy/119516072,['backend'],['c++'],,,,220000.0
Ведущий инженер по информационной безопасности (SOC),Банк России,Нижний Новгород,"Оперативный мониторинг состояния информационной безопасности в ИТ-инфраструктуре. Обнаружение, реагирование и расследование инцидентов информационной безопасности. Контроль выполнения требований нормативных и...",Приветствуется наличие сертификатов о прохождении сертифицированных курсов по вопросам информационной безопасности. Опыт администрирования ОС Windows / Linux. Опыт администрирования СУБД.,,,,2025-05-12,https://hh.ru/vacancy/120392372,"['tools', 'security']",['linux'],['senior'],,,
Build-инженер/программист,Тензор,Нижний Новгород,,Глубокое понимание принципов работы систем сборки и пакетных менеджеров. Опыт процесса сборки и пакетирования приложений на ЯП C++ под различные...,150000.0,250000.0,RUR,2025-05-12,https://hh.ru/vacancy/120395121,['backend'],['c++'],,,,200000.0
Инспектор группы защиты имущества и координации охранной деятельности,ГСП-ГСМ,Нижний Новгород,Обеспечение региональной безопасности производственной деятельности обособленного подразделения (ОП). Обеспечение внутренней и экономической безопасности Общества. Обеспечение сохранности имущества и активов Общества...,"Высшее или среднее профессиональное образование. Стаж работы по направлению деятельности в охранных структурах или подразделениях безопасности (правоохранительные органы, вооруженные силы...",110000.0,125000.0,RUR,2025-04-16,https://hh.ru/vacancy/119596781,['security'],,,,,117500.0
Системный аналитик,АЛМИ Партнер,Нижний Новгород,"Декомпозиция задач и формирование требований к дизайну, разработке (front-end, back-end) и QA. Консультировать разработчиков по мере реализации, а...","Опыт работы с REST, синхронными и асинхронными взаимодействиями. Умение разбирать формат сообщений протокола API. Опыт работы со Swagger.",,,,2025-04-15,https://hh.ru/vacancy/119542189,['data'],,,,,
ML инженер (разработка модельных сервисов),Т1,Нижний Новгород,"Анализ данных: выявлять ключевые факторы, формировать гипотезы и проверять их статистическими методами и ML-моделями. Внедрение сервисов: проектировать и внедрять...","...внедрения масштабируемых ML-решений в production. Опыт работы с облачными платформами (AWS, GCP, Azure) и их сервисами для ML и...",,,,2025-04-25,https://hh.ru/vacancy/119972566,"['ml', 'devops']","['azure', 'gcp', 'aws']",,,,
Системный аналитик,"Алабуга, ОЭЗ ППТ",Нижний Новгород,"Формализация, описание и декомпозиция задач для разработчиков. Участие в формировании бэклога проекта, сопровождение участников команд по задачам. Поддержка и обновление...",Умение составлять и описывать User Story. Тестирование разработанного по требованиям функционала. Сбор и анализ бизнес-требований и функциональных требований.,157500.0,,RUR,2025-04-14,https://hh.ru/vacancy/119484980,"['qa', 'data']",,,,,157500.0
Специалист по информационной и логической безопасности,НоваКард,Нижний Новгород,Аудит информационной системы организации на соответствие требованиям информационной безопасности внутренних и внешних нормативных документов. Разработка и контроль реализации корректирующих действий...,"Высшее образование по направлению ""Информационная безопасность"" (либо техническое в/о). Опыт работы в области информационной безопасности. Опыт администрирования сетевого и...",,,,2025-05-06,https://hh.ru/vacancy/120001534,['security'],,,,Bachelor,
Системный архитектор,Т1,Нижний Новгород,"Выявление нефункциональных требований и атрибутов качества. Разработка концепций интеграции сервисов, взаимодействия компонентов системы. Определение потребности в технических, аппаратных ресурсах.",Понимание вопросов DevSecOps и информационной безопасности. Понимание принципов работы CI/CD окружения. Понимание виртуальных машин и сред: навыки планирования ресурсов...,,,,2025-04-15,https://hh.ru/vacancy/119549866,"['security', 'devops']",['ci/cd'],['senior'],,,
Data Scientist (Computer Vision),YADRO,Нижний Новгород,"Основной задачей AI дивизиона является внедрение интеллектуальных функций в продукты YADRO с целью улучшения пользовательского опыта и повышения конкурентоспособности, а...","Опыт в разработке алгоритмов компьютерного зрения, знание основных алгоритмов ML/DL. Уверенное владение Python. Хорошее знание основных фреймворков и библиотек...",,,,2025-05-05,https://hh.ru/vacancy/118034819,"['ml', 'backend']","['python', 'cv']",,,,
Professional Supplier Quality Assurance,"We are a prominent technology company operating internationally, specializing in vehicle parts and accessories.",Нижний Новгород,"Continuously evaluate and improve the supplier assessment and development process to ensure efficiency, effectiveness, and compliance. Organization and maintain of...",Strong understanding of IATF 16949 requirements and their practical application in a supplier development context. Proficient level in quality improvement...,,,,2025-05-05,https://hh.ru/vacancy/119329951,,,,,,
Middle Data Engineer,АНО АЦГ,Нижний Новгород,Сбор и обработка данных из различных источников. Разработка автоматизированных решений для получения данных. Проектирование и разработка интеграций между информационными системами.,"Знание Python и основных библиотек для обработки данных (например, Pandas, NumPy). Понимание архитектуры REST API. Опыт работы с FastAPI или...",,,,2025-05-11,https://hh.ru/vacancy/119879111,['backend'],"['python', 'fastapi']",['middle'],,,
Специалист по тзи (монтажник скс),ФГУП НПП Гамма,Нижний Новгород,Осуществление комплекса услуг в области информационной безопасности.,"Среднее или высшее образование. Опыт работы со слаботочными системами. Навыки работы с ручным и электроинструментом (перфоратор, обжимной инструмент, дрель).",70000.0,,RUR,2025-05-05,https://hh.ru/vacancy/120209262,,,,,Bachelor,70000.0
Senior Frontend developer (Angular) / Фронтенд-разработчик (Release Engineering),YADRO,Нижний Новгород,"Она будет использоваться во всех подразделениях группы компаний YADRO, удовлетворять потребности разработчиков, QA инженеров и девопсов, обслуживать широкий спектр задач...","...фронтенд-приложений, желательно в сфере корпоративных решений или внутренних сервисов (enterprise/intranet). Уверенные знания Angular, JavaScript/TypeScript, ключевых концепций фронтенд...",,,,2025-04-29,https://hh.ru/vacancy/120086464,['web'],"['typescript', 'angular', 'javascript']",['senior'],,,
IT-специалист/Инженер,Газпром трансгаз Нижний Новгород,Нижний Новгород,"Осуществление эксплуатации и технического обслуживания средств и системы защиты информации. Знание операционных систем Windows,Linux. Настройка и сопровождение it-инфраструктуры...",Высшее профессиональное образование. Желательно с опытом работы.,50000.0,50000.0,RUR,2025-04-17,https://hh.ru/vacancy/119617503,,,,,,50000.0
Разработчик PHP (symfony),Электронная торговая площадка Торги223,Нижний Новгород,Участие в разработке и принятии архитектурных решений. Разработка нового функционала на стеке Symfony. Поддержка и оптимизация существующих модулей приложения.,"Понимание архитектуры сетевых приложений. Умение общаться и доносить свои мысли лаконично, объяснять свою позицию. Опыт разработки приложений, основанных на принципах...",180000.0,,RUR,2025-05-06,https://hh.ru/vacancy/119508297,,,,,,180000.0
Руководитель проектов по информационной безопасности,ICL Системные технологии,Нижний Новгород,"Взаимодействовать с Заказчиком по рабочим вопросам. Взаимодействовать, при необходимости, с Производителями средств защиты информации в рамках выполнения работ по проекту.",Опыт управления проектной командой. Знание и опыт работы с инструментами управления проектами. Умение работать с базовыми программами MS Office на...,,,,2025-04-30,https://hh.ru/vacancy/120117091,['security'],,,,Master,
Android разработчик (Middle),Модульбанк,Нижний Новгород,"Проектирование и проработка технических решений и архитектуры, их реализация. Разработка и поддержка мобильного приложения на платформе Android. Создание удобного и...","Опыт разработки под Android от 3 лет. Понимание различных архитектур (MVP, MVVM, Clean Architecture). Java/Kotlin и Android SDK.",,160000.0,RUR,2025-04-21,https://hh.ru/vacancy/119750113,"['mobile', 'backend']","['android', 'java', 'kotlin']","['middle', 'senior']",3,,160000.0
Инженер по тестированию цифровых модемов (Wireless modem QA engineer),YADRO,Нижний Новгород,Исследование и внедрение новых методик и программных пакетов автоматизации тестирования. Помощь разработчикам и интеграторам цифровых модемов в поиске и выявлении...,"Знакомство с устройством и принципами работы технологий беспроводной связи (IEEE 802.11ac/ax/ad/ay, 5G NR, LTE...",,,,2025-04-18,https://hh.ru/vacancy/119707274,['qa'],,,,,
