job_title,company,location,responsibilities,requirements,salary_from,salary_to,salary_currency,posted_date,url,category,skills,position,experience,education,salaryFrontend-разработчик Middle+ / Senior,Контент,Екатеринбург,разработка новых и доработка существующих UI компонентов. — участие в полном цикле разработки; — управление командой frontend-специалистов (2 человека). —,знание JavaScript ES6 и выше. — опыт коммерческой разработки с использованием React + Redux от 6 месяцев. — понимание и использование...,150000.0,300000.0,RUR,2025-05-11,https://hh.ru/vacancy/119640380,['web'],"['react', 'javascript']","['middle', 'senior']",,,225000.0
Frontend-разработчик Middle / Middle+,Контент,Екатеринбург,адаптивная вёрстка. — разработка новых и доработка существующих UI компонентов. — участие в полном цикле разработки.,знание JavaScript ES6 и выше. — опыт коммерческой разработки с использованием React + Redux от 6 месяцев. — понимание и использование...,100000.0,200000.0,RUR,2025-05-11,https://hh.ru/vacancy/119640388,['web'],"['react', 'javascript']",['middle'],,,150000.0
Программист,Малкова Татьяна Николаевна,Екатеринбург,Разработка и поддержка клиентской части веб-приложений и интерфейсов для системы доставки. - Оптимизация производительности фронтенда и улучшение пользовательского опыта. -,Опыт разработки фронтенда от 2-х лет. - Знание Vue.js и Nuxt.js. - Приветствуется знание PHP и Yii2. - Владение Git для...,100000.0,,RUR,2025-05-08,https://hh.ru/vacancy/120344322,"['tools', 'web']","['javascript', 'git', 'vue.js']",,2,,100000.0
Junior fullstack developer,ДОМА,Екатеринбург,Проектировать API и работать с GraphQL. — Участвовать в разработке веб-приложения на NextJs / React. — Работать в моно-репозиториях с сабмодулями. —,"Опыт разработки или прохождения профильных курсов в университете (fullstack, backend, frontend-разработка, базы данных) будет хорошим плюсом. — Писать аккуратный, читаемый...",40000.0,65000.0,RUR,2025-05-09,https://hh.ru/vacancy/116238335,"['web', 'backend']",,['junior'],,,52500.0
Директор службы безопасности,"Крупная компания, которая развивается в сегменте тяжелого машиностроения, имеет несколько филиалов в разных городах",Екатеринбург,"Организационная защита предприятия, защита коммерческой тайны. Обеспечение режима экономической и информационной безопасности. Контроль соблюдения требований режима безопасности сотрудниками и посетителями.",Основные цели должности:,150000.0,200000.0,RUR,2025-04-14,https://hh.ru/vacancy/119471403,['security'],,,,,175000.0
"Отраслевой бизнес-аналитик (направление металлургия, машиностроение)",СБЕР,Екатеринбург,Обеспечивать CSM (менеджер по успеху клиента) экспертной поддержкой на всех этапах цифровой трансформации в части консалтинга по закреплённой отрасли.,"Широкий кругозор по цифровым технологиям и цифровым решениям для бизнеса: Fintech, Big Data, Blockсhain, IoT, BI, AI\ML, ECM\ERP...",200000.0,,RUR,2025-05-12,https://hh.ru/vacancy/120381141,"['ml', 'data']",,,,,200000.0
Главный специалист отдела защиты информации и развития безопасных коммуникаций,Администрация города Екатеринбурга,Екатеринбург,Осуществлять работу с событиями информационной безопасности в целях выявления и реагирования на компьютерные инциденты и инциденты информационной безопасности с использованием...,"Руководящих документов ФСТЭК и ФСБ России по информационной безопасности. FW, UTM, NGFW. IDS/IPS. WAF. DLP. SIEM. PAM.",60000.0,80000.0,RUR,2025-04-25,https://hh.ru/vacancy/108381911,['security'],['siem'],,,,70000.0
Специалист по тестированию ПО (QA-engineer) Pre-Middle/Middle,Ренью,Екатеринбург,"Написанием чек-листов, тест-кейсов. Отслеживанием и описанием найденных багов. Функциональным, регрессионным, интеграционным тестированием. Автоматизированием сценариев для последующего регресса (Java...","Опыт тестирования API и БД: понимание RESTful API, уверенное пользование Swagger, Postman, DevTools. Опыт написания базовых SQL-запросов, опыт работы...",,,,2025-05-09,https://hh.ru/vacancy/101741106,"['qa', 'data']","['postman', 'sql']",['middle'],,,
Системный аналитик / System Analyst (junior/junior+),Студия Флаг,Екатеринбург,Сбор и анализ бизнес-требований. Коммуникация с клиентом и командой разработки. Разработка технических заданий (ТЗ) и постановка задач для разработчиков.,"Опыт работы в коммерческой разработке от 6 месяцев. Опыт работы с базами данных, знание принципов работы баз данных, типов данных.",55000.0,95000.0,RUR,2025-04-29,https://hh.ru/vacancy/120078215,['data'],,['junior'],,,75000.0
Системный администратор,ПромИТ,Екатеринбург,Проведение регламентных работ в инфраструктуре информационных систем. ​​​​​​​Ведение технической документации по эксплуатации. ​​​​​​​​​​​​​​​​​​​​​ Обеспечение информационной безопасности и защиты персональных данных.,...технической и аналитической документации. Английский язык на уровне чтения технической документации. Приветствуются знания и практические навыки в области информационной безопасности.,115000.0,,RUR,2025-05-12,https://hh.ru/vacancy/120053833,['security'],,,,,115000.0
Ведущий аналитик,СБЕР,Екатеринбург,Разработка моделей прогнозирования на основе углубленных математических моделей. Разработке моделей планирования показателей. Регулярная подготовка прогноза по финансовым и операционным показателям...,"Навыки работы на SQL. Digital- компетенции (Big Data, AI, ML) - на уровне общего понимания. Умение анализировать, структурировать и систематизировать информацию...",,,,2025-04-28,https://hh.ru/vacancy/120025653,"['ml', 'data']",['sql'],['senior'],,,
QA - инженер,СБЕР,Екатеринбург,Сотрудничество с командой разработчиков и аналитиками для сбора и понимания требований к продукту. Проводить ручное и автоматизированное тестирование веб-сервисов...,"Опыт разработки автотестов на Python. Знание теории тестирования, техник тест-анализа и тест-дизайна, умение применять теорию на практике.",,,,2025-04-23,https://hh.ru/vacancy/119865154,"['qa', 'backend']",['python'],,,,
PHP-разработчик,CHAI&COFFEE,Екатеринбург,Поддержка и доработка мобильных приложений (2 приложения действующие и 1 в разработке). Поддержка и доработка интеграции с кассовым оборудованием компании.,"Обязательное знание CSS, HTML, JS, PHP, MYSQL, работа с асинхронной загрузкой по типу aJax, fetch. Знание Android Studio и xCode.",145000.0,,RUR,2025-05-12,https://hh.ru/vacancy/120381619,"['web', 'mobile', 'data']","['android', 'mysql', 'javascript']",,,,145000.0
JavaScript Backend разработчик,JetStyle,Екатеринбург,"Поддерживать новые решения бизнеса в уже существующем коде. ️Изучать домен наших клиентов, чтобы помогать принимать осознанные решения для реализации нового...","Понимаешь, как работает современный веб, знаешь принципы REST API.",50000.0,,RUR,2025-05-12,https://hh.ru/vacancy/119489693,"['web', 'backend']",['javascript'],,,,50000.0
Technical Support Lead / Руководитель группы технической поддержки,Жизньмарт,Екатеринбург,"Goulash.tech - заказная разработка систем автоматизации и мобильных приложений для ресторанов. Сейчас мы в поисках Руководитель группы технической поддержки, который будет...","Опыт управления командами. Опыт работы в IT-компаниях. Будет преимуществом: Опыт работы в проектах в сфере розничной торговли (retail), в...",,,,2025-04-30,https://hh.ru/vacancy/119789756,,,['senior'],,,
Системный аналитик,Айдеко,Екатеринбург,"Сбором, анализом и документированием требований, поддержкой спецификаций требований в актуальном состоянии. Разработкой технических заданий, постановкой задач на разработку и исследование.","Навык структурировать и визуализировать информацию (диаграммы, схемы, user flows). Опыт работы с инструментами анализа (JIRA, Confluence, Miro, FigJam, диаграммы UML...",,,,2025-05-06,https://hh.ru/vacancy/120289493,"['tools', 'qa', 'data']",['jira'],,,,
Middle C# developer,ПромИТ,Екатеринбург,"Развивать функционал системы, включая web-сервисы и мобильные приложения. Участвовать в принятии технических и архитектурных решений. Реализовывать интеграцию со смежными...","C# (.NET 8-9), MS SQL / PostgreSQL. Web API, ASP.NET MVC, Avalonia. Android, Linux. GitLab, CI/CD. Уверенное владение C#...",,,,2025-05-12,https://hh.ru/vacancy/120268025,"['tools', 'mobile', 'devops', 'backend', 'web', 'data']","['ci/cd', 'postgresql', 'sql', 'linux', 'android', 'c#']",['middle'],,Master,
Python-разработчик,Sibdev,Екатеринбург,"Написания тестов с использованием Pytest. Настройки CI/CD пайплайнов (GitLab CI, Jenkins).","Имеете опыт разработки на Python от 4-х лет. Владеете FastAPI и Django и умеете проектировать REST API, которые легко...",150000.0,190000.0,RUR,2025-04-28,https://hh.ru/vacancy/120046511,['backend'],"['python', 'django', 'fastapi']",,4,,170000.0
Ведущий программист Python,"К Телеком,ООО",Екатеринбург,"...на python и частично Frontend. Поддержка существующих сервисов (личные кабинеты, биллинг). Разработка новых продуктов (веб стек, приложения на Python, проектирование...","Уверенное знание Linux: ООП, MVC, понимание принципов построения REST API. Приветствуется опыт разработки мобильных приложений. Опыт работы с git будет...",80000.0,130000.0,RUR,2025-04-28,https://hh.ru/vacancy/120012635,"['tools', 'backend']","['python', 'linux', 'git']",['senior'],,,105000.0
QA-инженер (Тестировщик 1С) в офис,Seller.ru,Екатеринбург,Тестирование задач: Проведение функционального и регрессионного тестирования разработанных решений на платформе 1С. Проверка кода разработчика: Анализ и проверка кода...,Опыт работы от 1 года. Язык запросов 1С (желательно). Знание типовых конфигураций 1С. Знание методологий тестирования.,120000.0,,RUR,2025-05-08,https://hh.ru/vacancy/119962938,['qa'],,,1,,120000.0
Специалист технической поддержки (удаленно),Удобные Решения,Екатеринбург,"...трекере задач, вносить клиентские настройки в нашу систему. Фиксировать и передавать в разработку информацию о технических сбоях в работе приложений.","Опыт поддержки пользователей ПО от 1 года. Уверенный пользователь ПК, MS Office, базовые знания web-технологий. Хорошая устная и письменная...",45000.0,51500.0,RUR,2025-05-12,https://hh.ru/vacancy/119314493,['web'],,,1,Master,48250.0
Интернет-маркетолог,СтаффПроЕКТ,Екатеринбург,Аккаунты и ресурсы предоставим. Привлечение целевой аудитории на сайты и мобильные приложения компании. Опыт настройки платных каналов привлечения трафика (Яндекс.Директ...,"Опыт работы в СРА-маркетинге, вертикали nutra, e-com, товарка. Углублённые знания в SEO, умение генерировать контентные проекты.",120000.0,,RUR,2025-04-25,https://hh.ru/vacancy/119961695,,,['intern'],,,120000.0
Frontend-разработчик,Кэпт,Екатеринбург,Разработка нового функционала и поддержка существующих решений на фронтенде. Улучшение пользовательского опыта и производительности интерфейсов. Разработка UI-компонентов с учетом...,Опыт работы с CI/CD. Понимание принципов UX/UI и опыт взаимодействия с Figma. Опыт оптимизации фронтенд-приложений.,,,,2025-04-14,https://hh.ru/vacancy/119502354,"['web', 'devops']",['ci/cd'],,,,
Начальник Управления информационных технологий,Расчетный центр Урала,Екатеринбург,Обеспечение бесперебойной работы IT-систем и сервисов. Контроль за соблюдением информационной безопасности. Взаимодействие с поставщиками IT-услуг и оборудования.,Опыт работы в сфере IT от 3 до 6 лет. Высшее образование в области информационных технологий или смежных областях.,120000.0,,RUR,2025-04-25,https://hh.ru/vacancy/119942129,,,,6,Bachelor,120000.0
SDET python (NGFW),ТехАргос,Екатеринбург,"Функциональное/нефункциональное тестирование. Ревью и анализ требований, тест-дизайн и создание тестовых сценариев. Документирование результатов тестирования: занесение дефектов в багтрекинговую...","Python (PyTest, Selenium, Requests). Linux (Ubuntu, Astra, Debian, Centos). TMS (Allure TestOps). OSI/ISO (wireshark, tcpdump). SQL (PostgreSQL, Clickhouse). GIT.",,,,2025-04-30,https://hh.ru/vacancy/120102299,"['tools', 'qa', 'backend', 'data']","['git', 'python', 'postgresql', 'sql', 'pytest', 'linux', 'selenium']",,,,
Системный администратор,ROSSVIK,Екатеринбург,"Обслуживание и обеспечение бесперебойной работы компьютерной и оргтехники на предприятии. Обнаружение, устранение неполадок в работе компьютеров и оборудования.","Знания основ и принципов работы современной офисной, компьютерной и сетевой техники. Знание стандартного офисного программного обеспечения. Администрирование операционных систем, в...",90000.0,100000.0,RUR,2025-05-06,https://hh.ru/vacancy/119176433,,,,,,95000.0
Тест-менеджер (QA Lead),Лаборатория качества,Екатеринбург,"...процессов в командах QA, улучшать их, внедрять метрики тестирования. Проводить оценку знаний QA инженеров, составлять ИПР, обучать QA инженеров.",2+ года опыта в роли QA Lead или тест-менеджера (обязательно). Опыт управления командой QA от 3-х сотрудников.,,,,2025-04-30,https://hh.ru/vacancy/120107647,['qa'],,['senior'],,,
Frontend-разработчик,СГМК,Екатеринбург,Анализ и оптимизация производительности веб-приложений. Реализация прогрессивных веб-приложений (PWA). Оптимизация времени отклика и уменьшение нагрузки на сервер.,"...Jest, Cypress, Playwright). Опыт работы с CI/CD и DevOps-процессами. Опыт работы в продуктовой разработке. Опыт оптимизации производительности фронтенда.",,,,2025-04-21,https://hh.ru/vacancy/117075843,"['web', 'qa', 'devops']","['cypress', 'ci/cd']",,,,
Государственный гражданский служащий,Инспекция Федеральной налоговой службы по Кировскому району г.Екатеринбурга,Екатеринбург,"работа с налогоплательщиками. -проведение камеральных проверок(отделы занимающиеся НДС, НДФЛ юр и физ. лиц, УСН, страховые взносы, прибыль юр.","Требования: ОКОНЧЕННОЕ среднее- профессиональное образование (по направлениям подготовки- право , экономика и управление, юриспруденция, информационная безопасность и др.) или высшее образование.",25000.0,42000.0,RUR,2025-04-22,https://hh.ru/vacancy/119795647,['security'],,,,Bachelor,33500.0
IT рекрутер,Лаборатория качества,Екатеринбург,"Подбор на открытые IT вакансии (QA Engineer, IT Project, менеджер по адаптации, QA Lead и т.д.). Соблюдение сроков по...",Результативный опыт работы от 3 лет в подборе IT сотрудников - обязательно. Опыт работы с Талантиксом или другой HR СRM - обязательно.,70000.0,100000.0,RUR,2025-04-15,https://hh.ru/vacancy/119543838,,,,3,,85000.0
Специалист в расчетно-экономический отдел,ГАУЗ СО ЦГКБ №24,Екатеринбург,"Формирование реестров в программе ЕЦП, . Работа в файлах Excel и XML. Соблюдение мер защиты информации.","Высшее образование. Опытный пользователь ПК. Навык работы с редакторами Word, Excel. Знание работы с цифровой платформой ГИС СО ""ЕЦП"", информационной...",60000.0,,RUR,2025-04-17,https://hh.ru/vacancy/119621451,,,,,Bachelor,60000.0
Full-stack разработчик (PHP/Laravel),Media Bite Ltd,Екатеринбург,"Участвовать в создании веб-приложений с нуля на PHP (Laravel), влияя на архитектуру и технические решения. Разрабатывать фронтенд и бэкенд...",Опыт разработки 2+ года на PHP/Laravel. Базовые навыки работы с JavaScript (желательно Vue.js). Умение верстать по макетам: HTML...,65000.0,390000.0,RUR,2025-05-09,https://hh.ru/vacancy/119709397,['web'],"['javascript', 'vue.js']",,,,227500.0
Java Script Разработчик,Центр Локализации Кириллица,Екатеринбург,Субтитрирование. Локализация. Глобализация. Гейминг. Вам предстоит разработка и поддержание клиентского приложения для озвучки. Оно представляет из себя специализированный аудио редактор...,Базовое понимание принципов ООП и структуры десктопных приложений. Языки и фреймворки: Владение JavaScript / TypeScript (будет плюсом знание Java / Kotlin).,150000.0,150000.0,RUR,2025-05-05,https://hh.ru/vacancy/120248775,"['web', 'mobile', 'backend']","['typescript', 'java', 'javascript', 'kotlin']",,,,150000.0
Исследователь данных (Data Scientist),СБЕР,Екатеринбург,"Выдвигать гипотезы, разрабатывать ML модели прогнозирования временных рядов (Python, SQL), генерировать фичи и сложную логику взаимозависимостей. Анализировать и подготавливать фактические...","Высшее образование. Опыт применения методов машинного обучения для решения задач прогнозирования, реализованные проекты. Понимание логики работы банковских продуктов.",,,,2025-04-28,https://hh.ru/vacancy/120024619,['ml'],,,,Bachelor,
