job_title,company,location,responsibilities,requirements,salary_from,salary_to,salary_currency,posted_date,url,category,skills,position,experience,education,salaryFrontend-разработчик,Red Digital,Санкт-Петербург,"Разработка нового функционала на TypeScript и Vue 3. Поддержка текущей кодовой базы (фичи, багфиксы). Написание и проведение тестов.",Минимальный вес и быстрая загрузка. Легкая встраиваемость. Удобное взаимодействие с браузерными API. Высокая производительность. Код пишется на чистом TypeScript с...,180000.0,250000.0,RUR,2025-05-11,https://hh.ru/vacancy/119640360,['web'],['typescript'],,,,215000.0
IOS разработчик (iGaming-прилы),Netteca,Санкт-Петербург,Разработка мобильных приложений. — Участие в обсуждении стратегии по приложениям. — Коммуникация с командой. — Выполнение KPI.,...приложений в App Store. Будет плюсом : Портфолио или примеры gambling-проектов. Опыт разработки мобильных приложений под Gambling. Опыт разработки приложений...,1000.0,,USD,2025-05-08,https://hh.ru/vacancy/120348992,['mobile'],['ios'],,,,1000.0
Специалист телемаркетинга,ТС Солюшен,Санкт-Петербург,"Вы НЕ будете заниматься продажами: главная задача – работа с базой потенциальных заказчиков из нашей CRM-системы, выявление потребности с дальнейшей...","Желателен опыт работы с исходящими звонками. Желание обучаться и развиваться в сфере Информационной безопасности. Хорошо развитый уровень коммуникации, открытость и...",80000.0,,RUR,2025-04-15,https://hh.ru/vacancy/104891503,['security'],,,,,80000.0
QA Specialist (Мир Танков),Леста Игры,Санкт-Петербург,"Ручное тестирование продукта «Мир танков» и инструментария, разрабатываемого для нужд проекта.",Базовые технические знания операционных систем Windows и приложений в них. Опыт работы в ручном тестировании от 1-2 лет.,,,,2025-05-11,https://hh.ru/vacancy/120228623,['qa'],,,2,,
Младший специалист по тестированию на проникновение (пентестер/pentester),Дейтерий,Санкт-Петербург,Выполнение тестирования на проникновение информационных систем различного назначения и состава. Практическая исследовательская работа по поиску уязвимостей прикладного и сетевого уровня...,Высшее или незаконченное высшее техническое образование и хорошая теоретическая подготовка в области информационных технологий и информационной безопасности. Знание английского языка...,80000.0,,RUR,2025-05-04,https://hh.ru/vacancy/118038998,['security'],,['junior'],,,80000.0
Программист-разработчик/Frontend Middle+/Senior (Vue),МК-Бизнес Онлайн,Санкт-Петербург,Переписывание компонентов ERP-системы. Участие в развитии и разработке нового функционала ERP-системы. Участие в проектировании и улучшении архитектуры системы.,Отличное знание паттернов. Опыт построения архитектуры приложения. Опыт работы с микросервисами. Опыт решения задач по переписыванию легаси на современные инструменты.,170000.0,225000.0,RUR,2025-05-10,https://hh.ru/vacancy/120354572,['web'],['vue.js'],"['middle', 'senior']",,,197500.0
Менеджер продукта - мобильные приложения,AppSelect,Санкт-Петербург,"Работа с гипотезами в мобильных приложениях. Управление продуктовым бэклогом, постановка задач команде (разработчикам, дизайнерам, маркетологам). Поиск точек роста для приложений.",Опыт работы с мобильными приложениями App Store и Google Play. Знание рынка приложений с подписочной монетизацией. Опыт работы с аналитикой...,,,,2025-05-06,https://hh.ru/vacancy/120289166,,,,,,
Тестировщик ПО,ООО СТЦ,Санкт-Петербург,"...кейсы, баг-репорты). Проведение функционального, регрессионного, smoke-тестирования СПО на разных платформах (Windows, Linux). Взаимодействие с командами разработчиков, технических писателей.",Опыт работы в тестировании десктопных приложений от 1 года. Знание техник тест-дизайна и жизненного цикла разработки ПО.,,,,2025-05-02,https://hh.ru/vacancy/117909417,['qa'],,,1,,
Frontend-разработчик (Angular),РЭД,Санкт-Петербург,"...логических блока, которые взаимодействуют между собой через API. Разработка веб-приложений для корпоративных систем с использованием Angular. Верстка пользовательского интерфейса...",Необходимые навыки: Коммерческий опыт работы с Angular от 1 года (обязательно). Уверенное знание JavaScript и TypeScript. Уверенное знание RxJS.,,,,2025-05-07,https://hh.ru/vacancy/120328650,['web'],"['typescript', 'angular', 'javascript']",,1,,
QA Engineer,БСС,Санкт-Петербург,"...web приложениями. Работа с тестовой документацией, поддержка в актуальном состоянии тест-кейсов. Выявление и описание ошибок понятным для разработчика языком...",Опыт проведения нагрузочного тестирования. Опыт проведения стресс-тестов. Опыт написания автотестов для web-интерфейса и rest api. Опыт работы с...,,,,2025-04-18,https://hh.ru/vacancy/119706612,"['web', 'qa']",,,,,
Офис-менеджер,AIPeople,Санкт-Петербург,"Всесторонняя поддержка работы офиса: своевременный заказ канцелярии, воды, продуктов и техники. Контроль за чистотой офиса (в основном, обслуживание кухни), за...","Уверенное владение ПК и офисной техникой. Внимательность, ответственность и пунктуальность. Позитивный настрой в работе. Грамотная речь (устная и письменная).",70000.0,,RUR,2025-05-09,https://hh.ru/vacancy/120289101,,,,,,70000.0
Junior Product Analyst,Sputnik8,Санкт-Петербург,"Помогать в поиске точек роста продукта. Настраивать атрибуцию мобильного приложения и сквозной аналитики с вебом. Построение отчетов, ad-hoc задачи.",Отличное владение Excel/Google sheets. Базовые знания SQL и (или) опыт анализа данных на Python. Знание основ математической статистики и...,,,,2025-05-07,https://hh.ru/vacancy/110861130,"['backend', 'data']","['python', 'sql']",['junior'],,,
Менеджер проектов / Менеджер digital-проектов,"Nimax, digital-агентство",Санкт-Петербург,"Взаимодействовать с клиентом: брифинг, ежедневное общение, встречи, презентации, согласование, отчеты. Организовывать работу над проектом: компоновать команду, планировать тайминг, ставить задачи...","Понимание веб-технологий: как работают фронтенд и бекенд, сетка вёрстки и ветка репозитория, сервер и хостинг, что такое SSL и...",100000.0,,RUR,2025-04-30,https://hh.ru/vacancy/120139429,['web'],,,,,100000.0
Backend-разработчик,ТестОпс,Санкт-Петербург,"...проектирования и реализации различных архитектурных паттернов хранения данных. Взаимодействие с командой frontend-разработки, QA и аналитиками для реализации новых фичей.",Опыт коммерческой разработки на Java (от 3 лет). Отличное знание Spring Framework. Опыт работы с реляционными базами данных (в проекте...,,,,2025-04-25,https://hh.ru/vacancy/119972297,['backend'],"['java', 'spring']",,3,,
Frontend-разработчик,Балтик Интеграйшенл Групп,Санкт-Петербург,"Разрабатывать интерфейсы и кабинеты — для менеджеров, контролеров, НR и других участников строительного процесса. Создавать веб-сервисы и внедрять их в...",Опыт коммерческой разработки на React от года. Уверенное знание HTML/CSS/JS/TS. Адаптивная Верстка по макетам из Figma.,,,,2025-04-25,https://hh.ru/vacancy/119969013,['web'],"['react', 'javascript']",,,,
Менеджер продукта,Альтиус Лаб,Санкт-Петербург,"Проведение конкурентного анализа (российские и зарубежные, прямые и косвенные конкуренты), сбор данных из открытых источников и путем взаимодействия с потенциальными...",Базовое понимание требований регуляторов в сфере информационной безопасности. Опыт запуска новых продуктов. Знание основ маркетинга и продаж B2B...,150000.0,,RUR,2025-05-10,https://hh.ru/vacancy/120327762,['security'],,,,,150000.0
IT директор,TOPTOP,Санкт-Петербург,"Учет и обеспечение материалами, оборудованием и программным обеспечением. Создание системы технической и информационной безопасности и управление системой. Организация процесса системного...","Успешный подтвержденный опыт эффективного управления командами разработчиков, в том числе 1С, web-разработчиками, удаленными командами и командами подрядчиков.",,,,2025-04-29,https://hh.ru/vacancy/120069022,['web'],,,,,
QA engineer,Топго Сервис,Санкт-Петербург,"Писать авто-тесты. Проводить ручное, авто, функциональное тестирование IT-продуктов. Находить несоответствие между реализованным функционалом и бизнес-требованиями.","Знание SQL на уровне написания стандартных запросов. Понимание основ разработки и тестирования web, desktop, API и мобильных приложений.",,100000.0,RUR,2025-04-14,https://hh.ru/vacancy/119505859,"['web', 'qa', 'data']",['sql'],,,,100000.0
Backend-разработчик,Вортекс Инновации,Санкт-Петербург,Создание фоновых задач и событийных функций с использованием BullMQ. Взаимодействие с командой фронтенда по вопросам передачи данных и аутентификации/сессий.,3+ лет коммерческого опыта в разработке бэкенда. Глубокие знания NestJS и Prisma. Опыт моделирования БД и работы с SQL...,3000.0,3500.0,USD,2025-05-05,https://hh.ru/vacancy/120240141,"['backend', 'data']",['sql'],,,,3250.0
"Front-End developer (JavaScript, jQuery)",Karma8,Санкт-Петербург,Верстать макеты дизайнера с учётом нюансов по адаптиву для мобильных устройств и переводить их в Twig-шаблоны. Программировать функционал фронтенда...,"Отличное знание JavaScript. Глубокие знания современных HTML/CSS, а также особенности их отображения в браузерах. Опыт работы с jQuery и...",2000.0,4000.0,USD,2025-05-10,https://hh.ru/vacancy/120160409,['web'],['javascript'],,,,3000.0
Фулстек-разработчик (React),Линия ИТ,Санкт-Петербург,Развивать и разрабатывать сервисы компании. Обеспечение бесперебойной работы сервисов. Писать UnitTest. Проводить CodeReview.,"Экспертное владение PHP 7.4+. Экспертное знание Mysql (ACID, работа с индексами, репликации). Следовать принципам KISS, DRY, SOLID и...",200000.0,,RUR,2025-05-12,https://hh.ru/vacancy/120266074,"['web', 'data']","['react', 'mysql']",,,,200000.0
Кассир,ФГБУ Национальный Медицинский Исследовательский Центр Онкологии Имени Н.Н. Петрова Министерства Здравоохранения Российской Федерации,Санкт-Петербург,"...содержащейся в первичных учетных документах, правила хранения документов и защиты информации. Основы информатики и вычислительной техники. Порядок ведения кассовых операций...",Образование - среднее профессиональное/высшее. Навыки работы на персональном компьютере – уверенный пользователь. Должен знать: основы законодательства Российской Федерации о бухгалтерском учете...,70000.0,70000.0,RUR,2025-04-21,https://hh.ru/vacancy/119751161,,,,,,70000.0
Project-менеджер,Светлые головы,Санкт-Петербург,"Коммуникация с проектными менеджерами и заказчиками продукта, разработчиками. Глубокое погружение в продукты компании. Документооборот по проектам. Следование графику внедрений, устранение...","Готовы рассмотреть кандидата без опыта, но с возможностью быстрого обучения. Навыки QA будут плюсом. Умение писать инструкции и описывать бизнес...",,,,2025-05-10,https://hh.ru/vacancy/119955536,['qa'],,,,,
QA/AQA Engineer,Инситех,Санкт-Петербург,"Работа с тест-кейсами в TestIt, актуализация документации. Взаимодействие с разработчиками, аналитиками и другими членами команды. Участие в планировании и...","Опыт работы от 3 лет в качестве QA Engineer (ручное и автоматизированное тестирование): опыт тестирования REST API, микросервисов, интеграционного тестирования.",,,,2025-05-06,https://hh.ru/vacancy/118208549,['qa'],,,3,,
Инженер по тестированию,Bercut,Санкт-Петербург,"Работать с техническими документами, стандартами мобильной связи. Совместно с аналитиками и разработчиками участвовать в исследованиях, выборе технических решений, создании прототипов...","Опыт работы с Jenkins. Опыт работы с SOA, HTTP (с приложением SoapUI). Знакомство с системами автотестирования. Умение использовать shell, python.",,,,2025-04-18,https://hh.ru/vacancy/119706998,"['qa', 'backend']","['python', 'jenkins']",,,,
Frontend developer (Gamedev),ROCKSTONE,Санкт-Петербург,"Командная разработка и развитие игры на TypeScript + React, Less, Webpack, JS. Быть творцом: делать новые и поддерживать старые фичи.","Знание — TypeScript, CSS-анимации, английский на уровне чтения документации. Опыт создания SPA-приложений и мобильных приложений. Знание английского языка на...",,,,2025-04-28,https://hh.ru/vacancy/120020260,['web'],['typescript'],,,,
Frontend developer,Группа Компаний MVS,Санкт-Петербург,"Внедрение новых функций, компонентов, страниц приложения (Vue 3). Проведение code-review.","Опыт работы на аналогичной роли в коммерческой разработке. Уверенные знания Typescript, Vue, VueRouter, Vuex. Владение HTML5, CSS3, на...",,,,2025-05-07,https://hh.ru/vacancy/116454941,['web'],"['typescript', 'vue.js']",,,,
Frontend-разработчик,Meet Market,Санкт-Петербург,Разработка и внедрение нового функционала. Поддержка и доработка текущего проекта. Работа с задачами через трекер. Взаимодействие с внутренним специалистом по...,Опыт коммерческой разработки от 3 лет. Отличное знание Vue 3 и сопутствующего стека. Умение работать самостоятельно и нести ответственность за...,200000.0,,RUR,2025-04-18,https://hh.ru/vacancy/119702324,['web'],['vue.js'],,3,,200000.0
Senior Motion Designer Generalist,Скайтек,Санкт-Петербург,"Создание рекламных видеороликов для мобильных игр или приложений - от идеи до реализации (динамика, цвет, звук, монтаж). Давайте вместе создавать игры...",Обязателен опыт создания креативов для маркетинга мобильных игр/приложений и наличие портфолио с примерами или showreel. Хорошие навыки работы с...,140000.0,200000.0,RUR,2025-05-11,https://hh.ru/vacancy/120343861,,,['senior'],,,170000.0
QA Lead/Руководитель группы тестирования,СиЗиДжи Криейшен,Санкт-Петербург,"Руководство командой QA: найм новых сотрудников, их обучение и профессиональное развитие. Организация работы команды QA: планирование, распределение задач, контроль выполнения.","Опыт в тестировании от 5 лет, в роли лида – от 1 года. Глубокие знания процессов тестирования и жизненного цикла ПО.",,250000.0,RUR,2025-05-12,https://hh.ru/vacancy/120383681,['qa'],,['senior'],5,,250000.0
DevOps-инженер,Е-Цифра,Санкт-Петербург,Облачные технологии: Опыт работы с Yandex Cloud или другими облачными провайдерами для интеграции и масштабирования инфраструктуры. Взаимодействие с разработчиками для...,"Опыт работы в DevOps или администрировании облачных систем от 2 лет. Понимание работы сетей. Работа с Sip серверами, Sip протоколами.",,,,2025-05-10,https://hh.ru/vacancy/120357199,['devops'],,,2,,
QA engineer,ATI.SU,Санкт-Петербург,Вручную тестировать backend и frontend сервисы. Писать и поддерживать тестовую документацию. Отвечать за выкладку и релизы наших продуктов.,Знание теории тестирования и техник тест-дизайна. Опыт тестирования web/мобильных приложений. Понимание клиент-серверной архитектуры и тестирования API: HTTP...,,,,2025-05-09,https://hh.ru/vacancy/119454703,"['web', 'qa']",,,,,
Младший инженер Linux + Windows,ICL Services,Санкт-Петербург,"Поддерживать серверные и инфраструктурные решения на базе продуктов Microsoft, а так же Unix систем. Вносить изменения в инфраструктуре заказчика, связанных...","Знание и опыт работы с Linux системами: Debian, Ubuntu, CentOS, RedOS, Astra Linux. Знание ОС семейства Windows: Windows Server 2008...",,,,2025-05-06,https://hh.ru/vacancy/120280090,['tools'],['linux'],['junior'],,,
Системный администратор,ГБУДО ЦРТ,Санкт-Петербург,"Обслуживание (администрирование) преимущественно серверных систем. Диагностика неисправностей ИС. Регламентные работы (обновление ПО, контроль состояния систем). Устанавливает права доступа и контролирует...",...характеристики компьютерной и офисной техники; основы техники безопасности; основы защиты информации. Умение производить сборку и тестирование компьютерных систем; быстро и...,40.0,70000.0,RUR,2025-04-25,https://hh.ru/vacancy/119393275,"['qa', 'security']",,,,,35020.0
Продуктовый дизайнер Middle+ / Senior,Доксинбокс,Москва,"Взаимодействовать с командами разработки и продукта: собирать требования, ставить задачи фронтенду, участвовать в дизайн-ревью и поддерживать работу в Agile...","Развитые коммуникативные навыки: работаешь не в вакууме, а напрямую с продактами, аналитиками, разработчиками — важно доносить идеи и аргументировать решения.",,,,2025-05-05,https://hh.ru/vacancy/120249448,,,"['middle', 'senior']",,,
