job_title,company,location,responsibilities,requirements,salary_from,salary_to,salary_currency,posted_date,url,category,skills,position,experience,education,salary
QA,Сравни,Москва,"Совершенствование и оптимизация процесса тестирования без потери его качества. Активное взаимодействие с разработчиками, системными аналитиками и иными членами команды.","...возникновении вопросов задавать их руководству, коллегам, обращаться за информацией к представителям других команд и перенимать положительный опыт других QA engineers.",,,,2025-05-12,https://hh.ru/vacancy/120391074,['qa'],,,,,
QA engineer / Тестировщик,Банк ПСБ,Москва,"Анализ новой функциональности, тест-дизайн, написание тест-кейсов. Тестирование мобильных приложений. Регрессионное тестирование функционала системы ДБО. Составление отчётов о проведенном...","Знание теории и методологии тестирования. Понимание цикла разработки мобильных, web и backend приложений. Опыт работы с Jira, Confluence, TestIT, Chrome...",,,,2025-05-12,https://hh.ru/vacancy/120394190,"['tools', 'web', 'qa', 'backend']",['jira'],,,,
"QA Engineer/Тестировщик (Middle, Senior)",X5 Tech,Москва,"Проводить функциональное, регрессионное и интеграционное тестирование программных продуктов. Регистрировать найденные ошибки в системах дефект–трекинга, проверять исправление ошибок.",Имеешь опыт в тестировании от 2 лет (Web/Mobile/Desktop). Знаешь теорию тестирования и техники тест-дизайна. Работаешь с SQL...,,,,2025-05-12,https://hh.ru/vacancy/120387705,"['web', 'mobile', 'data', 'qa']",['sql'],"['middle', 'senior']",2,,
Тестировщик junior+ / middle (Москва),ОНИН,Москва,"Плотная работа с бизнес-аналитиками, сбор и анализ требований к продукту с точки зрения тестировния. Тестирование серверной и клиентской части...","Опыт ручного тестирования от 3-х лет. Понимание клиент-серверного взаимодействия. Опыт работы с системами, использующими MQ (Rabbit, Kafka и...",,,,2025-05-12,https://hh.ru/vacancy/120385704,['qa'],,"['junior', 'middle']",3,,
Ручной тестировщик / Manual QA,OMI,Москва,"Ручное тестирование и локализация проблем(back-end 70% / front-end 30%). Помощь технической поддержке в локализации проблем. Заведение ошибок, написание...","Имеет опыт тестирования сложных WEB приложений от 1 года. Был боевой опыт функционального, интеграционного и тестирования API (Fiddler, Postman).",,,,2025-05-10,https://hh.ru/vacancy/120329974,"['web', 'qa']",['postman'],,1,,
QA инженер (тестировщик),Эшелон Технологии,Москва,Подготовка тестового окружения для проведения тестирования. Составление тест-плана и написание тест-кейсов. Выполнение всех видов тестирования ПО.,Понимание принципов работы Rest API. Опыт функционального тестирования web-приложений. Опыт ручного тестирования ПО. Опыт работы с баг-трекинговыми и...,,105000.0,RUR,2025-05-12,https://hh.ru/vacancy/120383608,"['web', 'qa']",,,,,105000.0
Специалист по экономической безопасности,АГР,Москва,"Проверка физического или юридического лица с использованием баз в закрытых и открытых источниках (СПРУТ, СПАРК, Кронос, ФССП, ФНП, ФМС, Кадарбитр...",Знание инструментов OSINT/HUMINT/FORENSIC. Опыт в составлении досье на физических и юридических лиц. Коммуникабельность и стрессоустойчивость.,,,,2025-05-12,https://hh.ru/vacancy/120397534,['security'],,,,,
QA Engineer (Mobile),Skyeng,Москва,"Ручное тестирование мобильного приложения Skyeng. Собирать, анализировать и приоритизировать требования, участвовать в проектировании пользовательского интерфейса. Отвечать за качество продукта на...","Имеет опыт тестирования мобильных приложений от 3 лет. Понимает специфику тестирования мобильных приложений. Знает, чем отличается мобильное приложение от мобильного...",,,,2025-05-12,https://hh.ru/vacancy/120393720,"['mobile', 'qa']",,,3,,
Frontend-разработчик (React),Группа компаний Аэроклуб,Москва,"Участие в принятии архитектурных решений, касающихся создаваемых продуктов. Постановка и толкование задач другим разработчикам команды, проведение code review.","Опыт коммерческой разработки от 3-х лет. Развитые навыки программирования, проектирования, анализа. Знания языков программирования JavaScript, Typescript, NodeJS — как основ...",,,,2025-05-12,https://hh.ru/vacancy/120381834,"['web', 'backend']","['node.js', 'typescript', 'react', 'javascript']",,3,,
Тестировщик (QA),"Квиз, плиз!",Москва,Создание тестовых пользователей. Формирование отчетов о результатах тестирования. Локализация и заведение дефектов. Постановка задач разработчикам по итогам тестирования.,Наши ожидания от твоего опыта: Уровень Middle. Знание жизненного цикла разработки ПО. Умение работать с тестовой документацией и трекинговыми системами.,,,,2025-05-11,https://hh.ru/vacancy/120362883,['qa'],,['middle'],,,
Middle/Senior frontend developer (react),X5 Tech,Москва,"Участие в проработке, планировании и оценке задач. Участие в проектировании и разработке архитектуры приложений. Ревью кода.","Хорошее знание JavaScript / TypeScript. Опыт разработки SPA от 3х лет на React, Redux/MobX. Умение писать поддерживаемый код.",,,,2025-05-12,https://hh.ru/vacancy/120379605,['web'],"['typescript', 'react', 'javascript']","['middle', 'senior']",3,,
"Middle Frontend разработчик (Javascript, React)",БиАй Продакшн,Москва,Разработка нового и доработка существующего функционала Frontend – разработка новых визуализаций и интерфейсов. Взаимодействие с командой Backend для обеспечения целостного развития...,"Хорошее знание и опыт работы с Javascript, Web API. Знание стандартов CSS на практике. Опыт работы с React.",140000.0,250000.0,RUR,2025-05-12,https://hh.ru/vacancy/120377808,['web'],"['react', 'javascript']",['middle'],,,195000.0
Manual QA Engineer (Middle),ЮНИРЕСТ,Москва,"Проводить ручное тестирование (функциональное и интеграционное). Разрабатывать сценарии тестирования. Настраивать и развертывать тестового окружения, готовить тестовые данные. Планировать выпуск релизов.","Имеешь опыт ручного тестирования от 2-х лет. Имеешь опыт работы с логами приложений. Будет плюсом, если имеешь опыт автоматизации...",,,,2025-04-21,https://hh.ru/vacancy/119771963,['qa'],,['middle'],2,,
Младший специалист по тестированию,Панина Анастасия Александровна,Москва,"1. Функциональное и нефункциональное тестирование: Проведение различных видов тестирования: функциональное, smoke-тесты, регрессионное, интеграционное, UI-тестирование. Тестирование API, баз данных...","Уверенное владение техниками тест-дизайна (эквивалентное разделение, граничные значения, таблицы решений и др.). Навыки работы с SQL. 5.",70000.0,,RUR,2025-05-05,https://hh.ru/vacancy/120226828,['data'],['sql'],['junior'],,,70000.0
Тестировщик,Группа компаний Аэроклуб,Москва,"Выполнение ручного тестирования веб-приложений. Выполнение тестирования мобильных приложений (iOs, Android). Обнаружение и документирование ошибок, контроль их исправления.","Опыт тестирования веб-сайтов со сложной функциональностью (frontend, backend). Опыт тестирования приложений (iOs, Android). Знание основ SQL (на уровне написания...",,,,2025-04-21,https://hh.ru/vacancy/119772757,"['mobile', 'qa', 'backend', 'web', 'data']","['ios', 'sql', 'android']",,,,
"Frontend-разработчик в Only (Next.js, React)",Онли,Москва,Разработка текущих клиентских проектов вместе с командой отдела разработки. Разработка клиентской части веб-приложений. Верстка страниц по макетам дизайнера.,"Уверенные знания JavaScript (ES6+). Умение верстать с нуля адаптивные интерфейсы с поддержкой современных браузеров. Уверенные знания HTML, CSS...",140000.0,,RUR,2025-04-14,https://hh.ru/vacancy/119479827,['web'],"['next.js', 'react', 'javascript']",,,,140000.0
Backend-разработчик,Хайстекс,Москва,"Написание чистого, поддерживаемого, и масштабируемого кода. - Отладка, устранение и решение проблем в кодовой базе. - Интеграция backend-сервисов с frontend-приложениями...","Уверенные знания Python. - Опыт работы с message brokers (RabbitMQ). - Опыт работы с веб-фреймворками (Tornado, Django, FastAPI, Sanic). -",,,,2025-05-12,https://hh.ru/vacancy/120386729,['backend'],"['python', 'django', 'fastapi']",,,,
Frontend разработчик React/React Native (Senior/Middle++),Эйайэксперт,Москва,"...разработчиками, дизайнерами, QA-инженерами и продакт-менеджерами. Производительность: поиск и устранение узких мест, оптимизация скорости работы и потребления ресурсов приложений.","Инструменты сборки и деплоя: опыт работы с инструментами сборки и деплоя frontend-приложений. Коммуникабельность: отличные коммуникативные навыки, способность эффективно взаимодействовать...",,,,2025-05-12,https://hh.ru/vacancy/120389773,"['web', 'mobile']","['react', 'react native']","['middle', 'senior']",,,
Full-stack QA Engineer,Альфа Капитал,Москва,"Разработка и выполнение тестовых сценариев для веб-приложения. Проведение функционального, регрессионного, интеграционного и нагрузочного тестирования. Автоматизация тестирования с использованием Java...",Имеете знание основ ООП и базовых паттернов проектирования. Понимаете принцип работы клиент-серверных приложений. Имеете опыт работы с системами контроля...,,,,2025-05-12,https://hh.ru/vacancy/120388739,['qa'],,,,,
Middle frontend developer (next.js),РБ,Москва,Участием в построении стратегии и роадмапа оптимизации проекта. Поиском новых возможностей для оптимизации проекта. Работой над задачами по оптимизации (Компоненты...,"Глубокое понимание TypeScript и Next.js, - важно иметь за плечами от 2-3 лет тесного сотрудничества с каждым инструментом.",,250000.0,RUR,2025-05-12,https://hh.ru/vacancy/120377515,['web'],"['typescript', 'next.js', 'javascript']",['middle'],3,,250000.0
IOS разработчик,ПАУЭР,Москва,"Работа над проектами в составе команды бекенд, фронтенд разработчиков и дизайнеров интерфейсов. Приоритетная задача реализовать запланированное мобильное приложение.","Умение работать с основными UI компонентами, опыт реализации кастомных View. Опыт работы с HTTP(S), REST API. Опыт работы с...",,,,2025-05-10,https://hh.ru/vacancy/120336513,['mobile'],['ios'],,,,
Manual QA Engineer (Middle),Flocktory,Москва,"Участвовать в улучшении процессов: предлагать идеи для повышения эффективности тестирования и автоматизации, анализировать метрики QA и помогать улучшать процессы, связанные...",Навыки тест-дизайна. Понимание принципов работы клиент-серверных приложений. Опыт тестирования веб-приложений. Понимание протокола HTTP/HTTPS. Опыт работы с...,,,,2025-05-07,https://hh.ru/vacancy/120318650,['qa'],,['middle'],,,
Manual QA Engineer (Gamedev),Студия Кефир,Москва,"Функциональное тестирование (игровых механик, проверка обновлений внутриигрового магазина, аналитики). Регрессионное тестирование. Составление тестовой документации. Воспроизведение отчётов об ошибках от игроков.","Опыт в ручном тестировании от 1 года. Навык тестирования клиентской части мобильных приложений. Знание игровых движков (Unity, Unreal Engine).",,,,2025-05-12,https://hh.ru/vacancy/118962879,['qa'],,,1,,
Senior/Middle Frontend Developer (JavaScript),Битрикс24,Москва,"Разрабатывать пользовательские интерфейсы приложений и сервисов. Писать безопасный, производительный и архитектурный код на нашем стеке технологий. Улучшать существующие интерфейсы, оптимизировать...","Стремились учиться и развиваться. Интересуетесь новыми технологиями во фронтенде. Представляете, как устроены современные фреймворки и библиотеки изнутри. Знакомы с инструментами...",,300000.0,RUR,2025-05-12,https://hh.ru/vacancy/120390858,['web'],['javascript'],"['middle', 'senior']",,,300000.0
Python разработчик / Python Developer,Aston,Москва,"...спринтов в рамках SCRUM. Сопровождение и документирование кода. Code Review и менторинг. Взаимодействие с аналитиками, тестировщиками, frontend-разработчиками и дизайнерами.",Современный стек технологий. Опыт работы в роли Python Developer от 2-х лет. Глубокое знание Python 3.12+.,,,,2025-05-12,https://hh.ru/vacancy/120386630,['backend'],['python'],,2,,
Frontend-разработчик (Лукоморье),Ростелеком Информационные Технологии,Москва,"Проведение код-ревью. Оценка трудоемкости задач. Взаимодействие с другими командами: backend-разработчиками; тестировщиками, аналитиками. Разработка экранов по макетам Figma, взаимодействие...","Отличное знание JavaScript, HTML, CSS. Опыт работы с любым CSS препроцессором: SASS, LESS, Stylus. Уверенное знание TypeScript. Хорошее знание библиотеки...",,,,2025-04-30,https://hh.ru/vacancy/120114103,['web'],"['typescript', 'javascript']",,,,
Директор по цифровой трансформации (CDTO),Кадровое Бюро Охота,Москва,"Разработка и внедрение стратегии цифровой трансформации в соответствии с общими целями компании, включая развитие банковских направлений. Анализ текущих бизнес-процессов...","...SAP системах и т. д. Широкий кругозор в области ИТ, отличное понимание принципов работы серверных систем, баз данных, информационной безопасности.",,,,2025-05-02,https://hh.ru/vacancy/120166622,['security'],,,,,
QA Engineer / Тестировщик,Верный Код,Москва,Проводить ручное тестирование клиентской и серверной части приложения. — Тестировать API-интерфейсы и взаимодействие между фронтом и бэком. — Выполнять тестирование пользовательских...,"Опыт ручного тестирования веб-приложений (фронтенд на React, бэкенд на NestJS). — Знание принципов работы REST и GraphQL API, уверенная работа...",,,,2025-05-10,https://hh.ru/vacancy/120354973,"['web', 'qa', 'backend']",['react'],,,,
Frontend-разработчик,Antal Talent,Москва,"Разработка UI/UX интерфейсы, визуализация справочников, запуск процессов, отчёты.","Желательно знание предметной области в области финансов, понимание как работает backend. Опыт(по крайней мере понимание) работы с FX, blockchain.",,,,2025-05-06,https://hh.ru/vacancy/120266553,"['web', 'backend']",,,,,
Видеомонтажер / Режиссёр / Режиссер монтажа,Коробко Антон Александрович,Москва,"Работа с AI-платформами для создания синтетических персонажей, голосов и анимации (например, Synthesia, D-ID, Descript, Murf.ai, Runway ML, klingai...","Глубокие знания в режиссуре и сценарном деле. Понимание, как правильно интерпретировать синопсис и превратить его в режиссёрский сценарий для дальнейшей...",1500.0,3500.0,EUR,2025-05-12,https://hh.ru/vacancy/120391331,,,,,,2500.0
Frontend-разработчик,ГНИВЦ,Москва,"Создание новых компонентов интерфейса на платформе React.js. Рефакторинг существующего кода. Взаимодействие с бэкендом (работа с FastAPI, Tanstack Query).","Понимание принципов удобства интерфейсов и доступности приложений, понимание user flow и базовых подходов к дизайну взаимодействия пользователей с приложением.",,,,2025-05-06,https://hh.ru/vacancy/120295456,['web'],,,,,
Middle QA Engineer,ИТ-Экспертиза,Москва,"...развитии окружения для тестирования. Ведение тестовой документации. Консультирование специалистов 1-й линии, разбор сложных ситуаций, воспроизведение программных ошибок для разработчиков.","Знание техник тест-дизайна и навыки грамотного их применения на практике, понимание специфики тестирования десктопного ПО и web-приложений.",,,,2025-04-28,https://hh.ru/vacancy/120025680,"['web', 'qa']",,['middle'],,,
Manual QA engineer,Finstar Financial Group,Москва,Подготовка тестовых данных. Анализ результатов тестирования и предоставление своевременной отчетности. Сотрудничество с командой разработчиков и тестировщиков для обеспечения непрерывного улучшения...,Опыт тестирования сложных систем – от 3 лет. Опыт тестирования внешних интеграций – от 1 года. Знание процессов разработки ПО при разных...,,,,2025-05-05,https://hh.ru/vacancy/120227969,['qa'],,,3,,
QA Engineer Manual,WebBee,Москва,"Проведение функционального, системного, регрессионного, smoke и приемочного тестирования. Локализация, заведение и контроль исправления дефектов. Разработка и сопровождение тестовой модели.",Понимаешь различные методологий разработки ПО. У тебя есть опыт работы в финансовой сфере\ ИТ компании\ банковской сфере от 2-х...,,,,2025-04-21,https://hh.ru/vacancy/119780414,['qa'],,,,,
React developer,ИЦ АЙ-ТЕКО,Москва,Стек проекта: БД Postgres. Брокер очередей Kafka.,В связи с активным развитием проектов в компании открыта вакансия Frontend react-разработчик. Ищем сотрудника с высшим техническим образованием (профиль...,200000.0,220000.0,RUR,2025-05-05,https://hh.ru/vacancy/120223111,['web'],['react'],,,,210000.0
